{
  "$schema": "https://json-schema.org/draft/2020-12/schema",
  "$id": "https://openclaw-videofactory.local/schemas/video_workflow/comment_signal.schema.json",
  "title": "Comment Signal",
  "type": "object",
  "required": [
    "signal_id",
    "platform",
    "cluster_label",
    "representative_text",
    "count",
    "sentiment",
    "source",
    "provenance",
    "status",
    "schema_version"
  ],
  "properties": {
    "signal_id": {
      "type": "string"
    },
    "platform": {
      "type": "string",
      "enum": [
        "douyin",
        "xiaohongshu",
        "kuaishou",
        "bilibili",
        "weibo",
        "synthetic"
      ]
    },
    "cluster_label": {
      "type": "string"
    },
    "representative_text": {
      "type": "string",
      "maxLength": 280
    },
    "count": {
      "type": "integer",
      "minimum": 1
    },
    "sentiment": {
      "type": "string",
      "enum": [
        "positive",
        "neutral",
        "negative",
        "mixed",
        "hostile"
      ]
    },
    "is_hostile": {
      "type": "boolean",
      "default": false
    },
    "prompt_injection_safe": {
      "type": "boolean",
      "default": true,
      "description": "hostile comments must never become model instructions"
    },
    "schema_version": {
      "type": "string",
      "const": "1.0"
    },
    "source": {
      "type": "object",
      "required": [
        "kind",
        "id"
      ],
      "properties": {
        "kind": {
          "type": "string",
          "enum": [
            "openclaw_skill",
            "provider_adapter",
            "human",
            "platform",
            "synthetic_fixture"
          ]
        },
        "id": {
          "type": "string"
        },
        "version": {
          "type": "string"
        }
      }
    },
    "provenance": {
      "type": "object",
      "properties": {
        "created_at": {
          "type": "string",
          "format": "date-time"
        },
        "created_by": {
          "type": "string"
        },
        "tool": {
          "type": "string"
        }
      }
    },
    "status": {
      "type": "string",
      "enum": [
        "draft",
        "active",
        "rejected",
        "superseded",
        "deprecated"
      ]
    },
    "confidence": {
      "type": "number",
      "minimum": 0,
      "maximum": 1
    },
    "validation_errors": {
      "type": "array",
      "items": {
        "type": "string"
      },
      "default": []
    }
  },
  "additionalProperties": false
}